<?xml version="1.0" encoding="UTF-8"?>
<synapse xmlns="http://www.bahadir.me/synapse" xmlns:xsi="http://www.w3.org/2001/XMLSchema-instance" xsi:schemaLocation="http://www.example.org/Synapse synapse.xsd ">
  <question text="Emdi yurek yırtulur mu?">
  	<answer text="Tabi">
  		<question text="Issız acun kaldı mı?">
  			<answer text="kaldı">
  				<leaf pass="true" />
  			</answer>
  			<answer text="kalmadı">
  				<leaf pass="false"></leaf>
  			</answer>
  		</question>

  	</answer>
  	<answer text="yok canım">
  		<leaf />
  	</answer>
  </question>
</synapse>
